,Unnamed: 0,abstract,lead_paragraph,headline,keywords,pub_date,news_desk,word_count,lead_paragraph_sw,lead_paragraph_sw_stem,date
76,2192,"The hackers have been targeting British, Canadian and American organizations racing to create coronavirus vaccines.","WASHINGTON _?Russian hackers are attempting to steal coronavirus vaccine research, the American, British and Canadian governments said Thursday, accusing the Kremlin of opening a new front in its spy battles with the West amid the worldwide competition to contain the pandemic.","{'main': 'Russia Is Trying to Steal Virus Vaccine Data, Western Nations Say', 'kicker': None, 'content_kicker': None, 'print_headline': 'Russians Accused of A Plot To Steal Vaccine Research', 'name': None, 'seo': None, 'sub': None}","[{'name': 'glocations', 'value': 'Russia', 'rank': 1, 'major': 'N'}, {'name': 'subject', 'value': 'Cyberwarfare and Defense', 'rank': 2, 'major': 'N'}, {'name': 'subject', 'value': 'Coronavirus (2019-nCoV)', 'rank': 3, 'major': 'N'}, {'name': 'organizations', 'value': 'National Security Agency', 'rank': 4, 'major': 'N'}, {'name': 'subject', 'value': 'Vaccination and Immunization', 'rank': 5, 'major': 'N'}, {'name': 'subject', 'value': 'Espionage and Intelligence Services', 'rank': 6, 'major': 'N'}, {'name': 'organizations', 'value': 'AstraZeneca PLC', 'rank': 7, 'major': 'N'}, {'name': 'organizations', 'value': 'Oxford University', 'rank': 8, 'major': 'N'}, {'name': 'subject', 'value': 'Drugs (Pharmaceuticals)', 'rank': 9, 'major': 'N'}, {'name': 'subject', 'value': 'Research', 'rank': 10, 'major': 'N'}, {'name': 'subject', 'value': 'Industrial Espionage', 'rank': 11, 'major': 'N'}]",2020-07-16T13:36:06+0000,Washington,1396,"WASHINGTON _?Russian hackers attempting steal coronavirus vaccine research, American, British Canadian governments said Thursday, accusing Kremlin opening new front spy battles West amid worldwide competition contain pandemic.","washington _?russian hacker attempt steal coronaviru vaccin research, american, british canadian govern said thursday, accus kremlin open new front spi battl west amid worldwid competit contain pandemic.",2020-07-16
77,2197,"Novavax just received the Trump administration__ largest vaccine contract. In the Maryland company__ 33-year history, it has never brought a vaccine to market.","In late February, as the coronavirus spread around the world, Dr. Richard Hatchett, the head of an international nonprofit that gives money to vaccine developers, got on an important call to discuss vaccine candidates after his plane touched down at London__ Heathrow Airport.","{'main': 'How a Struggling Company Won $1.6 Billion to Make a Coronavirus Vaccine', 'kicker': None, 'content_kicker': None, 'print_headline': 'Unproven Firm Got $1.6 Billion To Find a Cure', 'name': None, 'seo': None, 'sub': None}","[{'name': 'subject', 'value': 'Vaccination and Immunization', 'rank': 1, 'major': 'N'}, {'name': 'subject', 'value': 'Public-Private Sector Cooperation', 'rank': 2, 'major': 'N'}, {'name': 'subject', 'value': 'Coronavirus (2019-nCoV)', 'rank': 3, 'major': 'N'}, {'name': 'subject', 'value': 'Clinical Trials', 'rank': 4, 'major': 'N'}, {'name': 'subject', 'value': 'Government Contracts and Procurement', 'rank': 5, 'major': 'N'}, {'name': 'subject', 'value': 'Respiratory Syncytial Virus (RSV)', 'rank': 6, 'major': 'N'}, {'name': 'subject', 'value': 'United States Politics and Government', 'rank': 7, 'major': 'N'}, {'name': 'organizations', 'value': 'Biomedical Advanced Research and Development Authority', 'rank': 8, 'major': 'N'}, {'name': 'organizations', 'value': 'Gates, Bill and Melinda, Foundation', 'rank': 9, 'major': 'N'}, {'name': 'organizations', 'value': 'Emergent BioSolutions Inc', 'rank': 10, 'major': 'N'}, {'name': 'organizations', 'value': 'Health and Human Services Department', 'rank': 11, 'major': 'N'}, {'name': 'organizations', 'value': 'Novavax Inc', 'rank': 12, 'major': 'N'}, {'name': 'persons', 'value': 'Bright, Rick A', 'rank': 13, 'major': 'N'}, {'name': 'persons', 'value': 'Hatchett, Richard J', 'rank': 14, 'major': 'N'}, {'name': 'persons', 'value': 'Kadlec, Robert P', 'rank': 15, 'major': 'N'}, {'name': 'organizations', 'value': 'Coalition for Epidemic Preparedness Innovations', 'rank': 16, 'major': 'N'}, {'name': 'persons', 'value': 'Erck, Stanley C', 'rank': 17, 'major': 'N'}, {'name': 'organizations', 'value': 'Defense Department', 'rank': 18, 'major': 'N'}, {'name': 'persons', 'value': 'Trizzino, John J', 'rank': 19, 'major': 'N'}]",2020-07-16T14:32:42+0000,Science,2252,"In late February, coronavirus spread around world, Dr. Richard Hatchett, head international nonprofit gives money vaccine developers, got important call discuss vaccine candidates plane touched London__ Heathrow Airport.","In late february, coronaviru spread around world, dr. richard hatchett, head intern nonprofit give money vaccin developers, got import call discuss vaccin candid plane touch london_?heathrow airport.",2020-07-16
78,2405,"In Boston and in the Netherlands, scientists are racing to build a vaccine against the virus strangling the world.","Each workday morning in March, Noe Mercado drove through the desolate streets of Boston to a tall glass building on Blackfan Circle, in the heart of the city__ biotech hub. Most residents had gone into hiding from the coronavirus, but Mr. Mercado had an essential job: searching for a vaccine against this new, devastating pathogen.","{'main': 'Inside Johnson & Johnson__ Nonstop Hunt for a Coronavirus Vaccine', 'kicker': None, 'content_kicker': None, 'print_headline': 'The Vaccine Hunters', 'name': None, 'seo': None, 'sub': None}","[{'name': 'subject', 'value': 'your-feed-science', 'rank': 1, 'major': 'N'}, {'name': 'subject', 'value': 'Clinical Trials', 'rank': 2, 'major': 'N'}, {'name': 'subject', 'value': 'Coronavirus Risks and Safety Concerns', 'rank': 3, 'major': 'N'}, {'name': 'subject', 'value': 'Vaccination and Immunization', 'rank': 4, 'major': 'N'}, {'name': 'subject', 'value': 'Public-Private Sector Cooperation', 'rank': 5, 'major': 'N'}, {'name': 'subject', 'value': 'Coronavirus (2019-nCoV)', 'rank': 6, 'major': 'N'}, {'name': 'organizations', 'value': 'Beth Israel Deaconess Medical Center', 'rank': 7, 'major': 'N'}, {'name': 'organizations', 'value': 'Harvard University', 'rank': 8, 'major': 'N'}, {'name': 'organizations', 'value': 'Janssen Pharmaceutica', 'rank': 9, 'major': 'N'}, {'name': 'organizations', 'value': 'Johnson & Johnson', 'rank': 10, 'major': 'N'}, {'name': 'glocations', 'value': 'Netherlands', 'rank': 11, 'major': 'N'}, {'name': 'glocations', 'value': 'Boston (Mass)', 'rank': 12, 'major': 'N'}]",2020-07-17T17:00:21+0000,Science,2884,"Each workday morning March, Noe Mercado drove desolate streets Boston tall glass building Blackfan Circle, heart city__ biotech hub. Most residents gone hiding coronavirus, Mr. Mercado essential job: searching vaccine new, devastating pathogen.","each workday morn march, noe mercado drove desol street boston tall glass build blackfan circle, heart city_?biotech hub. most resid gone hide coronavirus, mr. mercado essenti job: search vaccin new, devast pathogen.",2020-07-17
79,2486,"Billions are being poured into developing a shot, but the rapid timetable and President Trump__ cheerleading are creating a whole new group of vaccine-hesitant patients.","Almost daily, President Trump and leaders worldwide say they are racing to develop a coronavirus vaccine, in perhaps the most urgent mission in the history of medical science. But the repeated assurances of near-miraculous speed are exacerbating a problem that has largely been overlooked and one that public health experts say must be addressed now: persuading people to actually get the shot.","{'main': 'Mistrust of a Coronavirus Vaccine Could Imperil Widespread Immunity', 'kicker': None, 'content_kicker': None, 'print_headline': 'Rising Mistrust of __arp Speed_?Vaccine May Prolong Pandemic', 'name': None, 'seo': None, 'sub': None}","[{'name': 'subject', 'value': 'Vaccination and Immunization', 'rank': 1, 'major': 'N'}, {'name': 'subject', 'value': 'Coronavirus (2019-nCoV)', 'rank': 2, 'major': 'N'}, {'name': 'subject', 'value': 'Polls and Public Opinion', 'rank': 3, 'major': 'N'}, {'name': 'subject', 'value': 'Coronavirus Risks and Safety Concerns', 'rank': 5, 'major': 'N'}, {'name': 'subject', 'value': 'your-feed-healthcare', 'rank': 6, 'major': 'N'}]",2020-07-18T09:00:13+0000,Science,1553,"Almost daily, President Trump leaders worldwide say racing develop coronavirus vaccine, perhaps urgent mission history medical science. But repeated assurances near-miraculous speed exacerbating problem largely overlooked one public health experts say must addressed now: persuading people actually get shot.","almost daily, presid trump leader worldwid say race develop coronaviru vaccine, perhap urgent mission histori medic science. but repeat assur near-miracul speed exacerb problem larg overlook one public health expert say must address now: persuad peopl actual get shot.",2020-07-18
80,2691,Readers criticize the president__ desire to eliminate funds for testing and point to his earlier vaccine skepticism. Also: New York City__ air quality; life in a van.,To the Editor:,"{'main': 'Trump__ Views on Covid Tests and Vaccines', 'kicker': 'letters', 'content_kicker': None, 'print_headline': 'Trump__ Views on Covid Tests and Vaccines', 'name': None, 'seo': None, 'sub': None}","[{'name': 'subject', 'value': 'United States Politics and Government', 'rank': 1, 'major': 'N'}, {'name': 'subject', 'value': 'Coronavirus (2019-nCoV)', 'rank': 2, 'major': 'N'}, {'name': 'subject', 'value': 'Tests (Medical)', 'rank': 3, 'major': 'N'}, {'name': 'subject', 'value': 'Vaccination and Immunization', 'rank': 4, 'major': 'N'}, {'name': 'persons', 'value': 'Trump, Donald J', 'rank': 5, 'major': 'N'}, {'name': 'organizations', 'value': 'Health and Mental Hygiene Department (NYC)', 'rank': 6, 'major': 'N'}, {'name': 'subject', 'value': 'Air Pollution', 'rank': 7, 'major': 'N'}, {'name': 'subject', 'value': 'Recreational Vehicles', 'rank': 8, 'major': 'N'}]",2020-07-20T18:44:31+0000,Letters,736,To Editor:,To editor:,2020-07-20
81,2792,Why developing a coronavirus vaccine may be easier than persuading people to get it.,Listen and subscribe to our podcast from your mobile device:Via Apple Podcasts | Via Spotify | Via Stitcher,"{'main': 'The Vaccine Trust Problem', 'kicker': None, 'content_kicker': None, 'print_headline': '', 'name': None, 'seo': None, 'sub': None}","[{'name': 'subject', 'value': 'Coronavirus (2019-nCoV)', 'rank': 1, 'major': 'N'}, {'name': 'subject', 'value': 'Vaccination and Immunization', 'rank': 2, 'major': 'N'}, {'name': 'subject', 'value': 'Rumors and Misinformation', 'rank': 3, 'major': 'N'}, {'name': 'organizations', 'value': 'Oxford University', 'rank': 4, 'major': 'N'}, {'name': 'persons', 'value': 'Trump, Donald J', 'rank': 5, 'major': 'N'}]",2020-07-21T10:00:26+0000,Podcasts,246,Listen subscribe podcast mobile device:Via Apple Podcasts | Via Spotify | Via Stitcher,listen subscrib podcast mobil device:via appl podcast | via spotifi | via stitcher,2020-07-21
82,2843,"Two suspects in China targeted companies working on vaccines as part of a broader cybertheft campaign to enrich themselves and aid the Chinese government, officials said.","WASHINGTON _?The Justice Department accused a pair of Chinese hackers on Tuesday of targeting vaccine development on behalf of the country__ intelligence service as part of a broader yearslong campaign of global cybertheft aimed at industries such as defense contractors, high-end manufacturing and solar energy companies.","{'main': 'U.S. Accuses Hackers of Trying to Steal Coronavirus Vaccine Data for China', 'kicker': None, 'content_kicker': None, 'print_headline': 'U.S. Says 2 Hackers Tried to Steal Coronavirus Vaccine Data for China', 'name': None, 'seo': None, 'sub': None}","[{'name': 'subject', 'value': 'Coronavirus (2019-nCoV)', 'rank': 1, 'major': 'N'}, {'name': 'subject', 'value': 'Espionage and Intelligence Services', 'rank': 2, 'major': 'N'}, {'name': 'subject', 'value': 'Classified Information and State Secrets', 'rank': 3, 'major': 'N'}, {'name': 'subject', 'value': 'Industrial Espionage', 'rank': 4, 'major': 'N'}, {'name': 'subject', 'value': 'Cyberwarfare and Defense', 'rank': 5, 'major': 'N'}, {'name': 'subject', 'value': 'Computers and the Internet', 'rank': 6, 'major': 'N'}, {'name': 'subject', 'value': 'Computer Security', 'rank': 7, 'major': 'N'}, {'name': 'organizations', 'value': 'Justice Department', 'rank': 8, 'major': 'N'}, {'name': 'glocations', 'value': 'China', 'rank': 9, 'major': 'N'}, {'name': 'organizations', 'value': ""Ministry of State Security of the People's Republic of China"", 'rank': 10, 'major': 'N'}, {'name': 'subject', 'value': 'United States Politics and Government', 'rank': 11, 'major': 'N'}, {'name': 'subject', 'value': 'Vaccination and Immunization', 'rank': 12, 'major': 'N'}, {'name': 'subject', 'value': 'Drugs (Pharmaceuticals)', 'rank': 13, 'major': 'N'}, {'name': 'subject', 'value': 'Research', 'rank': 14, 'major': 'N'}, {'name': 'persons', 'value': 'Li Xiaoyu', 'rank': 15, 'major': 'N'}, {'name': 'persons', 'value': 'Dong Jiazhi', 'rank': 16, 'major': 'N'}]",2020-07-21T17:07:57+0000,Washington,1376,"WASHINGTON _?The Justice Department accused pair Chinese hackers Tuesday targeting vaccine development behalf country__ intelligence service part broader yearslong campaign global cybertheft aimed industries defense contractors, high-end manufacturing solar energy companies.","washington _?the justic depart accus pair chines hacker tuesday target vaccin develop behalf country_?intellig servic part broader yearslong campaign global cybertheft aim industri defens contractors, high-end manufactur solar energi companies.",2020-07-21
83,2863,"Moderna, which is receiving $483 million from the U.S. government, told lawmakers it would not sell its vaccine at cost. Pfizer has said it would also profit, but has so far taken no government money.","Executives from four companies in the race to produce a coronavirus vaccine____straZeneca, Johnson & Johnson, Moderna Therapeutics and Pfizer ___old lawmakers on Tuesday that they are optimistic their products could be ready by the end of 2020 or the beginning of 2021. All four companies are testing vaccines in human clinical trials.","{'main': 'Some Vaccine Makers Say They Plan to Profit From Coronavirus Vaccine', 'kicker': None, 'content_kicker': None, 'print_headline': 'Some Firms Plan to Profit From Making A Vaccine', 'name': None, 'seo': None, 'sub': None}","[{'name': 'subject', 'value': 'Clinical Trials', 'rank': 1, 'major': 'N'}, {'name': 'subject', 'value': 'Vaccination and Immunization', 'rank': 2, 'major': 'N'}, {'name': 'subject', 'value': 'Coronavirus (2019-nCoV)', 'rank': 3, 'major': 'N'}, {'name': 'subject', 'value': 'United States Politics and Government', 'rank': 4, 'major': 'N'}, {'name': 'organizations', 'value': 'AstraZeneca PLC', 'rank': 5, 'major': 'N'}, {'name': 'organizations', 'value': 'Food and Drug Administration', 'rank': 6, 'major': 'N'}, {'name': 'organizations', 'value': 'House Committee on Energy and Commerce', 'rank': 7, 'major': 'N'}, {'name': 'organizations', 'value': 'Johnson & Johnson', 'rank': 8, 'major': 'N'}, {'name': 'organizations', 'value': 'Merck & Company Inc', 'rank': 9, 'major': 'N'}, {'name': 'organizations', 'value': 'Moderna Inc', 'rank': 10, 'major': 'N'}, {'name': 'organizations', 'value': 'Pfizer Inc', 'rank': 11, 'major': 'N'}, {'name': 'persons', 'value': 'Frazier, Kenneth C', 'rank': 12, 'major': 'N'}, {'name': 'persons', 'value': 'Gerberding, Julie L', 'rank': 13, 'major': 'N'}, {'name': 'subject', 'value': 'your-feed-healthcare', 'rank': 14, 'major': 'N'}]",2020-07-21T18:13:46+0000,Science,890,"Executives four companies race produce coronavirus vaccine _?AstraZeneca, Johnson & Johnson, Moderna Therapeutics Pfizer _?told lawmakers Tuesday optimistic products could ready end 2020 beginning 2021. All four companies testing vaccines human clinical trials.","execut four compani race produc coronaviru vaccin _?astrazeneca, johnson & johnson, moderna therapeut pfizer _?told lawmak tuesday optimist product could readi end 2020 begin 2021. all four compani test vaccin human clinic trials.",2020-07-21
84,2868,"Readers discuss using race, geography, age and other factors. Also: Working parents; subway riders in the pandemic; the disappearance of a Thai activist.",To the Editor:,"{'main': 'Deciding Who Should Be First in Line for the Coronavirus Vaccine', 'kicker': 'letters', 'content_kicker': None, 'print_headline': 'Who Should Be First in Line for the Vaccine?', 'name': None, 'seo': None, 'sub': None}","[{'name': 'subject', 'value': 'Coronavirus (2019-nCoV)', 'rank': 1, 'major': 'N'}, {'name': 'subject', 'value': 'Vaccination and Immunization', 'rank': 2, 'major': 'N'}, {'name': 'subject', 'value': 'Work-Life Balance', 'rank': 3, 'major': 'N'}, {'name': 'glocations', 'value': 'New York City', 'rank': 4, 'major': 'N'}, {'name': 'subject', 'value': 'Transit Systems', 'rank': 5, 'major': 'N'}, {'name': 'glocations', 'value': 'Thailand', 'rank': 6, 'major': 'N'}, {'name': 'persons', 'value': 'Wanchalerm Satsaksit', 'rank': 7, 'major': 'N'}]",2020-07-21T18:25:58+0000,Letters,748,To Editor:,To editor:,2020-07-21
85,2983,"Two pharmaceutical companies announced a nearly $2 billion contract for 600 million doses of a vaccine, with the first 100 million promised before the end of the year.",[Here__ what you need to know about Pfizer__ Covid-19 Vaccine.],"{'main': 'Pfizer Gets $1.95 Billion to Produce Coronavirus Vaccine by Year__ End', 'kicker': None, 'content_kicker': None, 'print_headline': 'U.S. Places a $2 Billion Wager In the Global Race for a Vaccine', 'name': None, 'seo': None, 'sub': None}","[{'name': 'subject', 'value': 'Coronavirus (2019-nCoV)', 'rank': 1, 'major': 'N'}, {'name': 'subject', 'value': 'Drugs (Pharmaceuticals)', 'rank': 2, 'major': 'N'}, {'name': 'subject', 'value': 'Clinical Trials', 'rank': 3, 'major': 'N'}, {'name': 'subject', 'value': 'Vaccination and Immunization', 'rank': 4, 'major': 'N'}, {'name': 'organizations', 'value': 'BioNTech SE', 'rank': 5, 'major': 'N'}, {'name': 'organizations', 'value': 'Pfizer Inc', 'rank': 6, 'major': 'N'}, {'name': 'subject', 'value': 'United States Politics and Government', 'rank': 7, 'major': 'N'}, {'name': 'organizations', 'value': 'Food and Drug Administration', 'rank': 8, 'major': 'N'}, {'name': 'persons', 'value': 'Azar, Alex M II', 'rank': 9, 'major': 'N'}, {'name': 'persons', 'value': 'Trump, Donald J', 'rank': 10, 'major': 'N'}, {'name': 'subject', 'value': 'Public-Private Sector Cooperation', 'rank': 11, 'major': 'N'}, {'name': 'subject', 'value': 'Government Contracts and Procurement', 'rank': 12, 'major': 'N'}, {'name': 'subject', 'value': 'RNA (Ribonucleic Acid)', 'rank': 13, 'major': 'N'}]",2020-07-22T12:36:54+0000,Washington,1360,[Here__ need know Pfizer__ Covid-19 Vaccine.],[here_?need know pfizer_?covid-19 vaccine.],2020-07-22
86,3025,"Besides the fact that there__ no coronavirus vaccine yet, the government usually lets the private sector handle it.","The Trump administration__ commitment on Wednesday to purchase 100 million doses of a not-yet-finished vaccine is unusual in two ways. The private sector buys most vaccines in the United States, not the government.","{'main': 'The U.S. Commits to Buying Millions of Vaccine Doses. Why That__ Unusual.', 'kicker': None, 'content_kicker': None, 'print_headline': 'An Unusual Commitment to an Unfinished Vaccine', 'name': None, 'seo': None, 'sub': None}","[{'name': 'subject', 'value': 'Coronavirus (2019-nCoV)', 'rank': 1, 'major': 'N'}, {'name': 'subject', 'value': 'Vaccination and Immunization', 'rank': 2, 'major': 'N'}, {'name': 'organizations', 'value': 'Pfizer Inc', 'rank': 3, 'major': 'N'}, {'name': 'subject', 'value': 'Prices (Fares, Fees and Rates)', 'rank': 4, 'major': 'N'}, {'name': 'subject', 'value': 'Government Contracts and Procurement', 'rank': 5, 'major': 'N'}, {'name': 'subject', 'value': 'Drugs (Pharmaceuticals)', 'rank': 6, 'major': 'N'}, {'name': 'glocations', 'value': 'United States', 'rank': 7, 'major': 'N'}]",2020-07-22T17:42:48+0000,Upshot,952,"The Trump administration__ commitment Wednesday purchase 100 million doses not-yet-finished vaccine unusual two ways. The private sector buys vaccines United States, government.","the trump administration_?commit wednesday purchas 100 million dose not-yet-finish vaccin unusu two ways. the privat sector buy vaccin unit states, government.",2020-07-22
87,3239,A weighted lottery gives everyone a chance at a drug or vaccine in short supply. But some have a better shot than others.,"When a coronavirus vaccine becomes available, who should get it first?","{'main': 'Who Gets the Covid-19 Vaccine First? Here__ One Idea', 'kicker': None, 'content_kicker': None, 'print_headline': 'How a Weighted Lottery Can Offer a Fair Shot', 'name': None, 'seo': None, 'sub': None}","[{'name': 'subject', 'value': 'Coronavirus (2019-nCoV)', 'rank': 1, 'major': 'N'}, {'name': 'subject', 'value': 'Rationing and Allocation of Resources', 'rank': 2, 'major': 'N'}, {'name': 'subject', 'value': 'Shortages', 'rank': 3, 'major': 'N'}, {'name': 'subject', 'value': 'Remdesivir (Drug)', 'rank': 4, 'major': 'N'}, {'name': 'subject', 'value': 'Vaccination and Immunization', 'rank': 5, 'major': 'N'}, {'name': 'subject', 'value': 'Drugs (Pharmaceuticals)', 'rank': 6, 'major': 'N'}]",2020-07-23T19:42:07+0000,Science,1115,"When coronavirus vaccine becomes available, get first?","when coronaviru vaccin becom available, get first?",2020-07-23
88,3505,Well-timed stock bets have generated big profits for senior executives and board members at companies developing vaccines and treatments.,"On June 26, a small South San Francisco company called Vaxart made a surprise announcement: A coronavirus vaccine it was working on had been selected by the U.S. government to be part of Operation Warp Speed, the flagship federal initiative to quickly develop drugs to combat Covid-19.","{'main': 'Corporate Insiders Pocket $1 Billion in Rush for Coronavirus Vaccine', 'kicker': None, 'content_kicker': None, 'print_headline': 'With Well-Timed Bets, Insiders  Cash In on Sprint for a Vaccine', 'name': None, 'seo': None, 'sub': None}","[{'name': 'subject', 'value': 'Coronavirus (2019-nCoV)', 'rank': 1, 'major': 'N'}, {'name': 'subject', 'value': 'Vaccination and Immunization', 'rank': 2, 'major': 'N'}, {'name': 'organizations', 'value': 'Vaxart Inc', 'rank': 3, 'major': 'N'}, {'name': 'persons', 'value': 'Floroiu, Andrei', 'rank': 4, 'major': 'N'}, {'name': 'organizations', 'value': 'Moderna Inc', 'rank': 5, 'major': 'N'}, {'name': 'organizations', 'value': 'Novavax Inc', 'rank': 6, 'major': 'N'}, {'name': 'organizations', 'value': 'Regeneron Pharmaceuticals Inc', 'rank': 7, 'major': 'N'}, {'name': 'subject', 'value': 'Drugs (Pharmaceuticals)', 'rank': 8, 'major': 'N'}, {'name': 'organizations', 'value': 'Armistice Capital LLC', 'rank': 9, 'major': 'N'}, {'name': 'subject', 'value': 'Stocks and Bonds', 'rank': 10, 'major': 'N'}]",2020-07-25T09:00:29+0000,Business,1934,"On June 26, small South San Francisco company called Vaxart made surprise announcement: A coronavirus vaccine working selected U.S. government part Operation Warp Speed, flagship federal initiative quickly develop drugs combat Covid-19.","On june 26, small south san francisco compani call vaxart made surpris announcement: A coronaviru vaccin work select u.s. govern part oper warp speed, flagship feder initi quickli develop drug combat covid-19.",2020-07-25
89,3701,"The studies each aim to enroll 30,000 people and determine whether the vaccines are safe and effective.",[Read more on Moderna__ Covid-19 vaccine.],"{'main': 'Moderna and Pfizer Begin Late-Stage Vaccine Trials', 'kicker': None, 'content_kicker': None, 'print_headline': 'Late-Stage Trials Start for 2 Vaccines; Each Study Needs 30,000 Volunteers', 'name': None, 'seo': None, 'sub': None}","[{'name': 'subject', 'value': 'Clinical Trials', 'rank': 1, 'major': 'N'}, {'name': 'subject', 'value': 'Vaccination and Immunization', 'rank': 2, 'major': 'N'}, {'name': 'subject', 'value': 'Public-Private Sector Cooperation', 'rank': 3, 'major': 'N'}, {'name': 'subject', 'value': 'Coronavirus (2019-nCoV)', 'rank': 4, 'major': 'N'}, {'name': 'subject', 'value': 'RNA (Ribonucleic Acid)', 'rank': 5, 'major': 'N'}, {'name': 'subject', 'value': 'Immune System', 'rank': 6, 'major': 'N'}, {'name': 'subject', 'value': 'Research', 'rank': 7, 'major': 'N'}, {'name': 'organizations', 'value': 'Moderna Inc', 'rank': 8, 'major': 'N'}, {'name': 'organizations', 'value': 'National Institute of Allergy and Infectious Diseases', 'rank': 9, 'major': 'N'}, {'name': 'organizations', 'value': 'Pfizer Inc', 'rank': 10, 'major': 'N'}, {'name': 'organizations', 'value': 'National Institutes of Health', 'rank': 11, 'major': 'N'}, {'name': 'persons', 'value': 'Fauci, Anthony S', 'rank': 12, 'major': 'N'}, {'name': 'persons', 'value': 'Collins, Francis S', 'rank': 13, 'major': 'N'}, {'name': 'subject', 'value': 'your-feed-healthcare', 'rank': 14, 'major': 'N'}]",2020-07-27T18:33:25+0000,Science,1006,[Read Moderna__ Covid-19 vaccine.],[read moderna_?covid-19 vaccine.],2020-07-27
