,Unnamed: 0,abstract,lead_paragraph,headline,keywords,pub_date,news_desk,word_count,lead_paragraph_sw,lead_paragraph_sw_stem,date
32,478,"The E.U. organized a teleconference to raise money for coronavirus vaccine research, drawing contributions from around the world.","BRUSSELS _?Prime ministers, a king, a prince and Madonna all chipped in to an $8 billion pot to fund a coronavirus vaccine.","{'main': 'World Leaders Join to Pledge $8 Billion for Vaccine as U.S. Goes It Alone', 'kicker': None, 'content_kicker': None, 'print_headline': 'As Nations Steer Billions  To Vaccine, U.S. Sits Out', 'name': None, 'seo': None, 'sub': None}","[{'name': 'subject', 'value': 'Coronavirus (2019-nCoV)', 'rank': 1, 'major': 'N'}, {'name': 'subject', 'value': 'Research', 'rank': 2, 'major': 'N'}, {'name': 'organizations', 'value': 'European Union', 'rank': 3, 'major': 'N'}, {'name': 'subject', 'value': 'United States International Relations', 'rank': 4, 'major': 'N'}, {'name': 'organizations', 'value': 'European Commission', 'rank': 5, 'major': 'N'}, {'name': 'persons', 'value': 'Trump, Donald J', 'rank': 6, 'major': 'N'}, {'name': 'organizations', 'value': 'Gates, Bill and Melinda, Foundation', 'rank': 7, 'major': 'N'}, {'name': 'persons', 'value': 'Tedros Adhanom Ghebreyesus', 'rank': 8, 'major': 'N'}]",2020-05-04T22:26:46+0000,Foreign,1122,"BRUSSELS _?Prime ministers, king, prince Madonna chipped $8 billion pot fund coronavirus vaccine.","brussel _?prime ministers, king, princ madonna chip $8 billion pot fund coronaviru vaccine.",2020-05-04
33,501,The technique aims to make a person__ cells churn out proteins that will stimulate the body to fight the coronavirus.,"Researchers at two Harvard-affiliated hospitals are adapting a proven form of gene therapy to develop a coronavirus vaccine, which they expect to test in people later this year, they announced on Monday.","{'main': 'A Coronavirus Vaccine Project Takes a Page From Gene Therapy', 'kicker': None, 'content_kicker': None, 'print_headline': 'Gene Therapy  Inspires Push  To Develop  Virus Vaccine', 'name': None, 'seo': None, 'sub': None}","[{'name': 'subject', 'value': 'Coronavirus (2019-nCoV)', 'rank': 1, 'major': 'N'}, {'name': 'subject', 'value': 'Vaccination and Immunization', 'rank': 2, 'major': 'N'}, {'name': 'subject', 'value': 'Genetic Engineering', 'rank': 3, 'major': 'N'}, {'name': 'organizations', 'value': 'Harvard University', 'rank': 4, 'major': 'N'}, {'name': 'organizations', 'value': 'Massachusetts General Hospital', 'rank': 5, 'major': 'N'}, {'name': 'organizations', 'value': 'Massachusetts Eye and Ear', 'rank': 6, 'major': 'N'}, {'name': 'persons', 'value': 'Grousbeck, Wyc', 'rank': 7, 'major': 'N'}, {'name': 'persons', 'value': 'Fazzalari, Emilia', 'rank': 8, 'major': 'N'}, {'name': 'persons', 'value': 'Freeman, Mason W', 'rank': 9, 'major': 'N'}, {'name': 'subject', 'value': 'your-feed-healthcare', 'rank': 10, 'major': 'N'}]",2020-05-05T02:00:07+0000,Science,1014,"Researchers two Harvard-affiliated hospitals adapting proven form gene therapy develop coronavirus vaccine, expect test people later year, announced Monday.","research two harvard-affili hospit adapt proven form gene therapi develop coronaviru vaccine, expect test peopl later year, announc monday.",2020-05-05
34,581,"The drug company, along with a German partner, is running tests in healthy volunteers. It__ one of several companies on an accelerated timetable to try to find a safe, effective vaccine.","Pfizer and the German pharmaceutical company BioNTech announced that their potential coronavirus vaccine began human trials in the United States on Monday. If the tests are successful, the vaccine could be ready for emergency use here as early as September.","{'main': 'Pfizer Begins Human Trials of Possible Coronavirus Vaccine', 'kicker': None, 'content_kicker': None, 'print_headline': '', 'name': None, 'seo': None, 'sub': None}","[{'name': 'subject', 'value': 'Vaccination and Immunization', 'rank': 1, 'major': 'N'}, {'name': 'subject', 'value': 'Drugs (Pharmaceuticals)', 'rank': 2, 'major': 'N'}, {'name': 'subject', 'value': 'Coronavirus (2019-nCoV)', 'rank': 3, 'major': 'N'}, {'name': 'organizations', 'value': 'Food and Drug Administration', 'rank': 4, 'major': 'N'}, {'name': 'organizations', 'value': 'Pfizer Inc', 'rank': 5, 'major': 'N'}, {'name': 'subject', 'value': 'Research', 'rank': 6, 'major': 'N'}, {'name': 'subject', 'value': 'your-feed-healthcare', 'rank': 7, 'major': 'N'}, {'name': 'subject', 'value': 'Clinical Trials', 'rank': 8, 'major': 'N'}, {'name': 'organizations', 'value': 'BioNTech SE', 'rank': 9, 'major': 'N'}]",2020-05-05T10:45:06+0000,Science,675,"Pfizer German pharmaceutical company BioNTech announced potential coronavirus vaccine began human trials United States Monday. If tests successful, vaccine could ready emergency use early September.","pfizer german pharmaceut compani biontech announc potenti coronaviru vaccin began human trial unit state monday. If test successful, vaccin could readi emerg use earli september.",2020-05-05
35,906,Being shut in has a way of bringing out our dark thoughts. But it__ also a chance for honest conversation.,"I recently read a heartbreaking story about a 15-year-old girl named Jo__ianni Smith, who hanged herself in her bedroom in Stockton, Calif., __ikely over stress from coronavirus lockdown,_?as the story put it. She left no note, and as with any suicide there are questions that may never be answered. But by all accounts Jo, as she was known, was a talented athlete and a musician who seemed her bubbly self even in the weeks before she took her own life.","{'main': 'There Is No Vaccine for Teenage Despair', 'kicker': None, 'content_kicker': None, 'print_headline': '', 'name': None, 'seo': None, 'sub': None}","[{'name': 'subject', 'value': 'Teenagers and Adolescence', 'rank': 1, 'major': 'N'}, {'name': 'subject', 'value': 'Anxiety and Stress', 'rank': 2, 'major': 'N'}, {'name': 'subject', 'value': 'Quarantine (Life and Culture)', 'rank': 3, 'major': 'N'}, {'name': 'subject', 'value': 'Coronavirus (2019-nCoV)', 'rank': 4, 'major': 'N'}, {'name': 'subject', 'value': 'Suicides and Suicide Attempts', 'rank': 5, 'major': 'N'}, {'name': 'subject', 'value': 'Parenting', 'rank': 6, 'major': 'N'}, {'name': 'subject', 'value': 'Depression (Mental)', 'rank': 7, 'major': 'N'}]",2020-05-07T09:57:38+0000,OpEd,1228,"I recently read heartbreaking story 15-year-old girl named Jo__ianni Smith, hanged bedroom Stockton, Calif., __ikely stress coronavirus lockdown,_?story put it. She left note, suicide questions may never answered. But accounts Jo, known, talented athlete musician seemed bubbly self even weeks took life.","I recent read heartbreak stori 15-year-old girl name jo__ianni smith, hang bedroom stockton, calif., __ike stress coronaviru lockdown,_?stori put it. she left note, suicid question may never answered. but account jo, known, talent athlet musician seem bubbl self even week took life.",2020-05-07
36,1034,The company announced that the Food and Drug Administration had cleared its application to proceed to a clinical trial involving about 600 people.,One of the first biotech companies to begin human trials of an experimental vaccine for the coronavirus is now ready to move onto the next phase of testing.,"{'main': 'Moderna Gets OK to Start Larger Trial for a Coronavirus Vaccine', 'kicker': None, 'content_kicker': None, 'print_headline': '', 'name': None, 'seo': None, 'sub': None}","[{'name': 'subject', 'value': 'your-feed-science', 'rank': 1, 'major': 'N'}, {'name': 'subject', 'value': 'Coronavirus (2019-nCoV)', 'rank': 2, 'major': 'N'}, {'name': 'subject', 'value': 'Clinical Trials', 'rank': 3, 'major': 'N'}, {'name': 'subject', 'value': 'Vaccination and Immunization', 'rank': 4, 'major': 'N'}, {'name': 'subject', 'value': 'Drugs (Pharmaceuticals)', 'rank': 5, 'major': 'N'}, {'name': 'organizations', 'value': 'Food and Drug Administration', 'rank': 6, 'major': 'N'}, {'name': 'organizations', 'value': 'Moderna Inc', 'rank': 7, 'major': 'N'}, {'name': 'subject', 'value': 'Biotechnology and Bioengineering', 'rank': 8, 'major': 'N'}]",2020-05-07T21:29:43+0000,Science,556,One first biotech companies begin human trials experimental vaccine coronavirus ready move onto next phase testing.,one first biotech compani begin human trial experiment vaccin coronaviru readi move onto next phase testing.,2020-05-07
37,1208,"While researchers across Canada are among the scientists working on coronavirus vaccines, the country doesn__ have the means to quickly produce any successful result.","As many provinces ease up on some coronavirus restrictions _?notably in Quebec, which has decided to reopen some schools _?the discussion about vaccines has been increasing.","{'main': 'For Canada, Finding a Vaccine Will Only Be Part of the Equation', 'kicker': 'CANADA LETTER', 'content_kicker': None, 'print_headline': '', 'name': None, 'seo': None, 'sub': None}","[{'name': 'subject', 'value': 'Vaccination and Immunization', 'rank': 1, 'major': 'N'}, {'name': 'subject', 'value': 'Coronavirus (2019-nCoV)', 'rank': 2, 'major': 'N'}, {'name': 'glocations', 'value': 'Canada', 'rank': 3, 'major': 'N'}, {'name': 'organizations', 'value': 'Jenner Institute (Oxford University)', 'rank': 4, 'major': 'N'}, {'name': 'organizations', 'value': 'University of Saskatchewan', 'rank': 5, 'major': 'N'}]",2020-05-08T19:17:51+0000,Foreign,1042,"As many provinces ease coronavirus restrictions _?notably Quebec, decided reopen schools _?discussion vaccines increasing.","As mani provinc eas coronaviru restrict _?notabl quebec, decid reopen school _?discuss vaccin increasing.",2020-05-08
38,1398,"Iran and other nations are also looking to steal data and exploit the pandemic with attacks on infrastructure, officials say.",WASHINGTON _?The F.B.I. and the Department of Homeland Security are preparing to issue a warning that China__ most skilled hackers and spies are working to steal American research in the crash effort to develop vaccines and treatments for the coronavirus. The efforts are part of a surge in cybertheft and attacks by nations seeking advantage in the pandemic.,"{'main': 'U.S. to Accuse China of Trying to Hack Vaccine Data, as Virus Redirects Cyberattacks', 'kicker': None, 'content_kicker': None, 'print_headline': 'U.S. to Accuse China Of Trying to Steal Data', 'name': None, 'seo': None, 'sub': None}","[{'name': 'subject', 'value': 'Coronavirus (2019-nCoV)', 'rank': 1, 'major': 'N'}, {'name': 'subject', 'value': 'United States International Relations', 'rank': 2, 'major': 'N'}, {'name': 'glocations', 'value': 'China', 'rank': 3, 'major': 'N'}, {'name': 'subject', 'value': 'Cyberwarfare and Defense', 'rank': 4, 'major': 'N'}, {'name': 'subject', 'value': 'Computers and the Internet', 'rank': 5, 'major': 'N'}, {'name': 'subject', 'value': 'Computer Security', 'rank': 6, 'major': 'N'}, {'name': 'subject', 'value': 'Espionage and Intelligence Services', 'rank': 7, 'major': 'N'}, {'name': 'subject', 'value': 'Medicine and Health', 'rank': 8, 'major': 'N'}, {'name': 'subject', 'value': 'United States Politics and Government', 'rank': 9, 'major': 'N'}, {'name': 'organizations', 'value': 'Federal Bureau of Investigation', 'rank': 10, 'major': 'N'}, {'name': 'organizations', 'value': 'Homeland Security Department', 'rank': 11, 'major': 'N'}, {'name': 'organizations', 'value': 'National Security Agency', 'rank': 12, 'major': 'N'}, {'name': 'glocations', 'value': 'Israel', 'rank': 13, 'major': 'N'}, {'name': 'glocations', 'value': 'Iran', 'rank': 14, 'major': 'N'}, {'name': 'glocations', 'value': 'South Korea', 'rank': 15, 'major': 'N'}]",2020-05-10T23:08:08+0000,Washington,1579,WASHINGTON _?The F.B.I. Department Homeland Security preparing issue warning China__ skilled hackers spies working steal American research crash effort develop vaccines treatments coronavirus. The efforts part surge cybertheft attacks nations seeking advantage pandemic.,washington _?the f.b.i. depart homeland secur prepar issu warn china_?skill hacker spi work steal american research crash effort develop vaccin treatment coronavirus. the effort part surg cybertheft attack nation seek advantag pandemic.,2020-05-10
39,1817,"Social media is already filling up with misinformation about a Covid-19 vaccine, months or years before one even exists.","The other night, midway through watching a clip from __landemic_?_?a documentary that went viral on social media last week, spreading baseless lies and debunked nonsense about the coronavirus to millions of Americans overnight _?I had a terrifying thought:","{'main': 'Get Ready for a Vaccine Information War', 'kicker': 'The Shift', 'content_kicker': None, 'print_headline': 'Bracing for a Vaccine Information War', 'name': None, 'seo': None, 'sub': None}","[{'name': 'subject', 'value': 'Vaccination and Immunization', 'rank': 1, 'major': 'N'}, {'name': 'subject', 'value': 'Coronavirus (2019-nCoV)', 'rank': 2, 'major': 'N'}, {'name': 'subject', 'value': 'Fringe Groups and Movements', 'rank': 3, 'major': 'N'}, {'name': 'subject', 'value': 'Rumors and Misinformation', 'rank': 4, 'major': 'N'}, {'name': 'subject', 'value': 'Social Media', 'rank': 5, 'major': 'N'}, {'name': 'organizations', 'value': 'Centers for Disease Control and Prevention', 'rank': 6, 'major': 'N'}, {'name': 'creative_works', 'value': 'Plandemic (Movie)', 'rank': 7, 'major': 'N'}, {'name': 'subject', 'value': 'Video Recordings, Downloads and Streaming', 'rank': 8, 'major': 'N'}]",2020-05-13T15:00:07+0000,Business,1186,"The night, midway watching clip __landemic_?_?documentary went viral social media last week, spreading baseless lies debunked nonsense coronavirus millions Americans overnight _?I terrifying thought:","the night, midway watch clip __landemic_?_?documentari went viral social media last week, spread baseless lie debunk nonsens coronaviru million american overnight _?I terrifi thought:",2020-05-13
40,1891,The chief operating officer will be an Army general who specializes in logistics.,"WASHINGTON _?President Trump has picked a former executive of a major pharmaceutical company to lead Operation Warp Speed, the government__ effort to speed up development of a vaccine for the coronavirus, a senior administration official said Wednesday.","{'main': 'Trump Picks Ex-Drug Company Executive to Lead Accelerated Coronavirus Vaccine Effort', 'kicker': None, 'content_kicker': None, 'print_headline': 'Vaccine Hunt Prepares for __arp Speed_?, 'name': None, 'seo': None, 'sub': None}","[{'name': 'subject', 'value': 'Coronavirus (2019-nCoV)', 'rank': 1, 'major': 'N'}, {'name': 'subject', 'value': 'Vaccination and Immunization', 'rank': 2, 'major': 'N'}, {'name': 'organizations', 'value': 'Biomedical Advanced Research and Development Authority', 'rank': 3, 'major': 'N'}, {'name': 'organizations', 'value': 'GlaxoSmithKline PLC', 'rank': 4, 'major': 'N'}, {'name': 'organizations', 'value': 'Johnson & Johnson', 'rank': 5, 'major': 'N'}, {'name': 'persons', 'value': 'Bright, Rick A', 'rank': 6, 'major': 'N'}, {'name': 'persons', 'value': 'Slaoui, Moncef M', 'rank': 7, 'major': 'N'}, {'name': 'persons', 'value': 'Trump, Donald J', 'rank': 8, 'major': 'N'}, {'name': 'persons', 'value': 'Perna, Gustave F', 'rank': 9, 'major': 'N'}]",2020-05-14T00:00:58+0000,Washington,901,"WASHINGTON _?President Trump picked former executive major pharmaceutical company lead Operation Warp Speed, government__ effort speed development vaccine coronavirus, senior administration official said Wednesday.","washington _?presid trump pick former execut major pharmaceut compani lead oper warp speed, government_?effort speed develop vaccin coronavirus, senior administr offici said wednesday.",2020-05-14
41,2170,"The president named Moncef Slaoui, a former pharmaceutical executive, to lead a crash development program that if successful would shatter speed records for vaccine development.","President Trump doubled down on Friday on his promise to have a coronavirus vaccine available by the end of this year, betting that he can rally the pharmaceutical industry and the government to have one available to nearly all Americans at a speed never before accomplished.","{'main': 'Trump Vows Vaccine by End of Year, and Mobilizes Military to Help', 'kicker': None, 'content_kicker': None, 'print_headline': 'Promising Vaccine by the End of This Year, Trump Pledges Global Teamwork', 'name': None, 'seo': None, 'sub': None}","[{'name': 'subject', 'value': 'Vaccination and Immunization', 'rank': 1, 'major': 'N'}, {'name': 'subject', 'value': 'Coronavirus (2019-nCoV)', 'rank': 2, 'major': 'N'}, {'name': 'subject', 'value': 'Biotechnology and Bioengineering', 'rank': 3, 'major': 'N'}, {'name': 'subject', 'value': 'United States Politics and Government', 'rank': 4, 'major': 'N'}, {'name': 'subject', 'value': 'Drugs (Pharmaceuticals)', 'rank': 5, 'major': 'N'}, {'name': 'persons', 'value': 'Slaoui, Moncef M', 'rank': 6, 'major': 'N'}, {'name': 'persons', 'value': 'Trump, Donald J', 'rank': 7, 'major': 'N'}, {'name': 'glocations', 'value': 'United States', 'rank': 8, 'major': 'N'}]",2020-05-15T14:00:53+0000,Washington,1607,"President Trump doubled Friday promise coronavirus vaccine available end year, betting rally pharmaceutical industry government one available nearly Americans speed never accomplished.","presid trump doubl friday promis coronaviru vaccin avail end year, bet ralli pharmaceut industri govern one avail nearli american speed never accomplished.",2020-05-15
42,2488,The company said a test in 8 healthy volunteers found its experimental vaccine was safe and provoked a strong immune response. It is on an accelerated timetable to begin larger human trials soon.,[Read more on Moderna__ Covid-19 vaccine.],"{'main': 'Moderna Coronavirus Vaccine Trial Shows Promising Early Results', 'kicker': None, 'content_kicker': None, 'print_headline': 'Vaccine__ Early Test Result  Elevates Hopes and Stocks', 'name': None, 'seo': None, 'sub': None}","[{'name': 'subject', 'value': 'Vaccination and Immunization', 'rank': 1, 'major': 'N'}, {'name': 'subject', 'value': 'Coronavirus (2019-nCoV)', 'rank': 2, 'major': 'N'}, {'name': 'organizations', 'value': 'Moderna Inc', 'rank': 3, 'major': 'N'}, {'name': 'subject', 'value': 'Research', 'rank': 4, 'major': 'N'}, {'name': 'subject', 'value': 'Clinical Trials', 'rank': 5, 'major': 'N'}, {'name': 'subject', 'value': 'Quarantines', 'rank': 6, 'major': 'N'}, {'name': 'subject', 'value': 'Antibodies', 'rank': 7, 'major': 'N'}, {'name': 'organizations', 'value': 'Food and Drug Administration', 'rank': 8, 'major': 'N'}, {'name': 'subject', 'value': 'your-feed-science', 'rank': 9, 'major': 'N'}, {'name': 'subject', 'value': 'your-feed-healthcare', 'rank': 10, 'major': 'N'}, {'name': 'organizations', 'value': 'National Institute of Allergy and Infectious Diseases', 'rank': 11, 'major': 'N'}, {'name': 'subject', 'value': 'RNA (Ribonucleic Acid)', 'rank': 12, 'major': 'N'}, {'name': 'glocations', 'value': 'United States', 'rank': 13, 'major': 'N'}]",2020-05-18T12:14:45+0000,Science,1538,[Read Moderna__ Covid-19 vaccine.],[read moderna_?covid-19 vaccine.],2020-05-18
43,2837,"A series of animal experiments may point the way to an effective human vaccine, scientists said.","A prototype vaccine has protected monkeys from the coronavirus, researchers reported on Wednesday, a finding that offers new hope for effective human vaccines.","{'main': 'Prototype Vaccine Protects Monkeys From Coronavirus', 'kicker': 'matter', 'content_kicker': None, 'print_headline': 'Prototype Protects Monkeys From the Coronavirus', 'name': None, 'seo': None, 'sub': None}","[{'name': 'subject', 'value': 'your-feed-science', 'rank': 1, 'major': 'N'}, {'name': 'subject', 'value': 'Clinical Trials', 'rank': 2, 'major': 'N'}, {'name': 'subject', 'value': 'Coronavirus (2019-nCoV)', 'rank': 3, 'major': 'N'}, {'name': 'subject', 'value': 'Vaccination and Immunization', 'rank': 4, 'major': 'N'}, {'name': 'subject', 'value': 'Monkeys and Apes', 'rank': 5, 'major': 'N'}, {'name': 'subject', 'value': 'Antibodies', 'rank': 6, 'major': 'N'}, {'name': 'subject', 'value': 'Immune System', 'rank': 7, 'major': 'N'}, {'name': 'organizations', 'value': 'Beth Israel Deaconess Medical Center', 'rank': 8, 'major': 'N'}, {'name': 'organizations', 'value': 'Science (Journal)', 'rank': 9, 'major': 'N'}, {'name': 'organizations', 'value': 'National Institutes of Health', 'rank': 10, 'major': 'N'}, {'name': 'glocations', 'value': 'Boston (Mass)', 'rank': 11, 'major': 'N'}]",2020-05-20T14:09:40+0000,Science,1134,"A prototype vaccine protected monkeys coronavirus, researchers reported Wednesday, finding offers new hope effective human vaccines.","A prototyp vaccin protect monkey coronavirus, research report wednesday, find offer new hope effect human vaccines.",2020-05-20
44,2872,Scientists are increasingly optimistic that a vaccine can be produced in record time. But getting it manufactured and distributed will pose huge challenges.,"In a medical research project nearly unrivaled in its ambition and scope, volunteers worldwide are rolling up their sleeves to receive experimental vaccines against the coronavirus _?only months after the virus was identified.","{'main': 'A New Entry in the Race for a Coronavirus Vaccine: Hope', 'kicker': None, 'content_kicker': None, 'print_headline': 'Labs Step Up Race to Be First, Or Even 4th, to Find a Vaccine', 'name': None, 'seo': None, 'sub': None}","[{'name': 'subject', 'value': 'Coronavirus (2019-nCoV)', 'rank': 1, 'major': 'N'}, {'name': 'subject', 'value': 'Vaccination and Immunization', 'rank': 2, 'major': 'N'}, {'name': 'subject', 'value': 'Clinical Trials', 'rank': 3, 'major': 'N'}, {'name': 'subject', 'value': 'Factories and Manufacturing', 'rank': 4, 'major': 'N'}, {'name': 'subject', 'value': 'United States Politics and Government', 'rank': 5, 'major': 'N'}, {'name': 'subject', 'value': 'Immune System', 'rank': 6, 'major': 'N'}, {'name': 'organizations', 'value': 'Inovio Pharmaceuticals', 'rank': 7, 'major': 'N'}, {'name': 'organizations', 'value': 'Moderna Inc', 'rank': 8, 'major': 'N'}, {'name': 'organizations', 'value': 'Beth Israel Deaconess Medical Center', 'rank': 9, 'major': 'N'}, {'name': 'subject', 'value': 'Research', 'rank': 10, 'major': 'N'}, {'name': 'subject', 'value': 'your-feed-science', 'rank': 11, 'major': 'N'}]",2020-05-20T17:58:32+0000,Science,1556,"In medical research project nearly unrivaled ambition scope, volunteers worldwide rolling sleeves receive experimental vaccines coronavirus _?months virus identified.","In medic research project nearli unriv ambit scope, volunt worldwid roll sleev receiv experiment vaccin coronaviru _?month viru identified.",2020-05-20
45,2878,Scientists are using many techniques to develop coronavirus vaccines.,Scientists are using many techniques to develop coronavirus vaccines.,"{'main': 'Different Approaches to a Coronavirus Vaccine', 'kicker': None, 'content_kicker': None, 'print_headline': '', 'name': None, 'seo': None, 'sub': None}","[{'name': 'subject', 'value': 'Vaccination and Immunization', 'rank': 1, 'major': 'N'}, {'name': 'subject', 'value': 'Viruses', 'rank': 2, 'major': 'N'}, {'name': 'subject', 'value': 'Coronavirus (2019-nCoV)', 'rank': 3, 'major': 'N'}, {'name': 'subject', 'value': 'Immune System', 'rank': 4, 'major': 'N'}, {'name': 'subject', 'value': 'Antibodies', 'rank': 5, 'major': 'N'}, {'name': 'subject', 'value': 'Biotechnology and Bioengineering', 'rank': 6, 'major': 'N'}, {'name': 'subject', 'value': 'RNA (Ribonucleic Acid)', 'rank': 7, 'major': 'N'}, {'name': 'subject', 'value': 'DNA (Deoxyribonucleic Acid)', 'rank': 8, 'major': 'N'}]",2020-05-20T18:47:04+0000,Science,0,Scientists using many techniques develop coronavirus vaccines.,scientist use mani techniqu develop coronaviru vaccines.,2020-05-20
46,2882,Sobering lessons from the history of the polio vaccine.,"On a spring morning in 1955, a pair of press officers greeted a mob of reporters in a stately hall on the University of Michigan campus. The officers had hot news: A clinical trial of the long-awaited polio vaccine had proved it to be safe and effective. The reporters nearly rioted in their scramble to spread the word. Once they did, church bells rang, and people ran into the streets to cheer.","{'main': 'What to Expect When a Coronavirus Vaccine Finally Arrives', 'kicker': None, 'content_kicker': None, 'print_headline': '', 'name': None, 'seo': None, 'sub': None}","[{'name': 'subject', 'value': 'Vaccination and Immunization', 'rank': 1, 'major': 'N'}, {'name': 'subject', 'value': 'Poliomyelitis', 'rank': 2, 'major': 'N'}, {'name': 'subject', 'value': 'Coronavirus (2019-nCoV)', 'rank': 3, 'major': 'N'}, {'name': 'subject', 'value': 'Clinical Trials', 'rank': 4, 'major': 'N'}, {'name': 'subject', 'value': 'Epidemics', 'rank': 5, 'major': 'N'}, {'name': 'glocations', 'value': 'United States', 'rank': 6, 'major': 'N'}]",2020-05-20T19:00:08+0000,OpEd,1184,"On spring morning 1955, pair press officers greeted mob reporters stately hall University Michigan campus. The officers hot news: A clinical trial long-awaited polio vaccine proved safe effective. The reporters nearly rioted scramble spread word. Once did, church bells rang, people ran streets cheer.","On spring morn 1955, pair press offic greet mob report state hall univers michigan campus. the offic hot news: A clinic trial long-await polio vaccin prove safe effective. the report nearli riot scrambl spread word. onc did, church bell rang, peopl ran street cheer.",2020-05-20
